<?xml version='1.0' encoding='utf-8'?>
<ns0:SMC_Deklaration xmlns:ns0="http://ccsap.bit.admin.ch/SWISSMEDIC/LIMS_HMIT_KHZ" xmlns:xsi="http://www.w3.org/2001/XMLSchema-instance" xsi:schemaLocation="http://ccsap.bit.admin.ch/SWISSMEDIC/LIMS_HMIT_KHZ https://ogd.swissmedic.ch/hmd/ZL/172/Beschreibungen/OGD-Deklarationen.xsd"><DEKLARATION><ZULASSUNGSNUMMER>10029</ZULASSUNGSNUMMER><SEQUENZNUMMER>2</SEQUENZNUMMER><KOMPONENTENNUMMER>1</KOMPONENTENNUMMER><KOMPONENTE>(N/A)</KOMPONENTE><ZEILENNUMMER>2</ZEILENNUMMER><SORTIERUNG_ZEILENNUMMER>2</SORTIERUNG_ZEILENNUMMER><ZEILENTYP>S</ZEILENTYP><STOFF_ID>001F295B11971ED2B6E5DBB42F203FA0</STOFF_ID><STOFFKATEGORIE>WIRKS</STOFFKATEGORIE><MENGE>31</MENGE><MENGEN_EINHEIT>MG</MENGEN_EINHEIT><DEKLARATIONSART>1</DEKLARATIONSART></DEKLARATION><DEKLARATION><ZULASSUNGSNUMMER>10029</ZULASSUNGSNUMMER><SEQUENZNUMMER>2</SEQUENZNUMMER><KOMPONENTENNUMMER>1</KOMPONENTENNUMMER><KOMPONENTE>(N/A)</KOMPONENTE><ZEILENNUMMER>3</ZEILENNUMMER><SORTIERUNG_ZEILENNUMMER>3</SORTIERUNG_ZEILENNUMMER><ZEILENTYP>S</ZEILENTYP><STOFF_ID>001F295B11971ED2B6E5DB26AA8E7FA0</STOFF_ID><STOFFKATEGORIE>WIRKS</STOFFKATEGORIE><MENGE>31</MENGE><MENGEN_EINHEIT>MG</MENGEN_EINHEIT><DEKLARATIONSART>1</DEKLARATIONSART></DEKLARATION><DEKLARATION><ZULASSUNGSNUMMER>10029</ZULASSUNGSNUMMER><SEQUENZNUMMER>2</SEQUENZNUMMER><KOMPONENTENNUMMER>1</KOMPONENTENNUMMER><KOMPONENTE>(N/A)</KOMPONENTE><ZEILENNUMMER>4</ZEILENNUMMER><SORTIERUNG_ZEILENNUMMER>4</SORTIERUNG_ZEILENNUMMER><ZEILENTYP>S</ZEILENTYP><STOFF_ID>001F295B11971ED2B6E5E0BF56E5BFA2</STOFF_ID><STOFFKATEGORIE>WIRKS</STOFFKATEGORIE><MENGE>31</MENGE><MENGEN_EINHEIT>MG</MENGEN_EINHEIT><DEKLARATIONSART>1</DEKLARATIONSART></DEKLARATION><DEKLARATION><ZULASSUNGSNUMMER>10029</ZULASSUNGSNUMMER><SEQUENZNUMMER>2</SEQUENZNUMMER><KOMPONENTENNUMMER>1</KOMPONENTENNUMMER><KOMPONENTE>(N/A)</KOMPONENTE><ZEILENNUMMER>5</ZEILENNUMMER><SORTIERUNG_ZEILENNUMMER>8</SORTIERUNG_ZEILENNUMMER><ZEILENTYP>S</ZEILENTYP><STOFF_ID>001F295B11971ED2B6E5DBE2A8F99FA0</STOFF_ID><STOFFKATEGORIE>WIRKS</STOFFKATEGORIE><MENGE>31</MENGE><MENGEN_EINHEIT>MG</MENGEN_EINHEIT><DEKLARATIONSART>1</DEKLARATIONSART></DEKLARATION><DEKLARATION><ZULASSUNGSNUMMER>10029</ZULASSUNGSNUMMER><SEQUENZNUMMER>2</SEQUENZNUMMER><KOMPONENTENNUMMER>1</KOMPONENTENNUMMER><KOMPONENTE>(N/A)</KOMPONENTE><ZEILENNUMMER>6</ZEILENNUMMER><SORTIERUNG_ZEILENNUMMER>7</SORTIERUNG_ZEILENNUMMER><ZEILENTYP>S</ZEILENTYP><STOFF_ID>001F295B11971ED2B6E5DAC8A140DFA0</STOFF_ID><STOFFKATEGORIE>WIRKS</STOFFKATEGORIE><MENGE>46</MENGE><MENGEN_EINHEIT>MG</MENGEN_EINHEIT><DEKLARATIONSART>1</DEKLARATIONSART></DEKLARATION><DEKLARATION><ZULASSUNGSNUMMER>10029</ZULASSUNGSNUMMER><SEQUENZNUMMER>2</SEQUENZNUMMER><KOMPONENTENNUMMER>1</KOMPONENTENNUMMER><KOMPONENTE>(N/A)</KOMPONENTE><ZEILENNUMMER>7</ZEILENNUMMER><SORTIERUNG_ZEILENNUMMER>6</SORTIERUNG_ZEILENNUMMER><ZEILENTYP>S</ZEILENTYP><STOFF_ID>001F295B11971ED2B6E5DDE422A8FFA1</STOFF_ID><STOFFKATEGORIE>WIRKS</STOFFKATEGORIE><MENGE>62</MENGE><MENGEN_EINHEIT>MG</MENGEN_EINHEIT><DEKLARATIONSART>1</DEKLARATIONSART></DEKLARATION><DEKLARATION><ZULASSUNGSNUMMER>10029</ZULASSUNGSNUMMER><SEQUENZNUMMER>2</SEQUENZNUMMER><KOMPONENTENNUMMER>1</KOMPONENTENNUMMER><KOMPONENTE>(N/A)</KOMPONENTE><ZEILENNUMMER>8</ZEILENNUMMER><SORTIERUNG_ZEILENNUMMER>5</SORTIERUNG_ZEILENNUMMER><ZEILENTYP>S</ZEILENTYP><STOFF_ID>001F295B11971ED2B6E5E0B811D8FFA2</STOFF_ID><STOFFKATEGORIE>WIRKS</STOFFKATEGORIE><MENGE>93</MENGE><MENGEN_EINHEIT>MG</MENGEN_EINHEIT><DEKLARATIONSART>1</DEKLARATIONSART></DEKLARATION><DEKLARATION><ZULASSUNGSNUMMER>10167</ZULASSUNGSNUMMER><SEQUENZNUMMER>1</SEQUENZNUMMER><KOMPONENTENNUMMER>1</KOMPONENTENNUMMER><KOMPONENTE>(N/A)</KOMPONENTE><ZEILENNUMMER>10</ZEILENNUMMER><SORTIERUNG_ZEILENNUMMER>9</SORTIERUNG_ZEILENNUMMER><ZEILENTYP>S</ZEILENTYP><STOFF_ID>001F295B11971ED2B6E5D3684D013F9F</STOFF_ID><STOFFKATEGORIE>WIRKS</STOFFKATEGORIE><MENGE>0.21</MENGE><MENGEN_EINHEIT>MGG</MENGEN_EINHEIT><DEKLARATIONSART>1</DEKLARATIONSART></DEKLARATION><DEKLARATION><ZULASSUNGSNUMMER>10167</ZULASSUNGSNUMMER><SEQUENZNUMMER>1</SEQUENZNUMMER><KOMPONENTENNUMMER>1</KOMPONENTENNUMMER><KOMPONENTE>(N/A)</KOMPONENTE><ZEILENNUMMER>11</ZEILENNUMMER><SORTIERUNG_ZEILENNUMMER>10</SORTIERUNG_ZEILENNUMMER><ZEILENTYP>S</ZEILENTYP><STOFF_ID>001F295B11971ED2B6E5D3684D009F9F</STOFF_ID><STOFFKATEGORIE>WIRKS</STOFFKATEGORIE><MENGE>0.291</MENGE><MENGEN_EINHEIT>MGG</MENGEN_EINHEIT><DEKLARATIONSART>1</DEKLARATIONSART></DEKLARATION><DEKLARATION><ZULASSUNGSNUMMER>10167</ZULASSUNGSNUMMER><SEQUENZNUMMER>1</SEQUENZNUMMER><KOMPONENTENNUMMER>1</KOMPONENTENNUMMER><KOMPONENTE>(N/A)</KOMPONENTE><ZEILENNUMMER>12</ZEILENNUMMER><SORTIERUNG_ZEILENNUMMER>11</SORTIERUNG_ZEILENNUMMER><ZEILENTYP>S</ZEILENTYP><STOFF_ID>001F295B11971ED2B6E5FB2E0BF0DFB0</STOFF_ID><STOFFKATEGORIE>WIRKS</STOFFKATEGORIE><MENGE>0.016</MENGE><MENGEN_EINHEIT>MGG</MENGEN_EINHEIT><DEKLARATIONSART>1</DEKLARATIONSART></DEKLARATION><DEKLARATION><ZULASSUNGSNUMMER>10167</ZULASSUNGSNUMMER><SEQUENZNUMMER>1</SEQUENZNUMMER><KOMPONENTENNUMMER>1</KOMPONENTENNUMMER><KOMPONENTE>(N/A)</KOMPONENTE><ZEILENNUMMER>13</ZEILENNUMMER><SORTIERUNG_ZEILENNUMMER>12</SORTIERUNG_ZEILENNUMMER><ZEILENTYP>S</ZEILENTYP><STOFF_ID>001F295B11971ED2B6E5D3684CFFFF9F</STOFF_ID><STOFFKATEGORIE>WIRKS</STOFFKATEGORIE><MENGE>0.00011</MENGE><MENGEN_EINHEIT>MGG</MENGEN_EINHEIT><DEKLARATIONSART>1</DEKLARATIONSART></DEKLARATION><DEKLARATION><ZULASSUNGSNUMMER>10167</ZULASSUNGSNUMMER><SEQUENZNUMMER>1</SEQUENZNUMMER><KOMPONENTENNUMMER>1</KOMPONENTENNUMMER><KOMPONENTE>(N/A)</KOMPONENTE><ZEILENNUMMER>14</ZEILENNUMMER><SORTIERUNG_ZEILENNUMMER>13</SORTIERUNG_ZEILENNUMMER><ZEILENTYP>S</ZEILENTYP><STOFF_ID>001F295B11971ED2B6E5D377CC935F9F</STOFF_ID><STOFFKATEGORIE>WIRKS</STOFFKATEGORIE><MENGE>0.00245</MENGE><MENGEN_EINHEIT>MGG</MENGEN_EINHEIT><DEKLARATIONSART>1</DEKLARATIONSART></DEKLARATION><DEKLARATION><ZULASSUNGSNUMMER>10167</ZULASSUNGSNUMMER><SEQUENZNUMMER>1</SEQUENZNUMMER><KOMPONENTENNUMMER>1</KOMPONENTENNUMMER><KOMPONENTE>(N/A)</KOMPONENTE><ZEILENNUMMER>15</ZEILENNUMMER><SORTIERUNG_ZEILENNUMMER>14</SORTIERUNG_ZEILENNUMMER><ZEILENTYP>S</ZEILENTYP><STOFF_ID>001F295B11971ED2B6E5CE185ADADF9F</STOFF_ID><STOFFKATEGORIE>WIRKS</STOFFKATEGORIE><MENGE>0.078</MENGE><MENGEN_EINHEIT>MGG</MENGEN_EINHEIT><DEKLARATIONSART>1</DEKLARATIONSART></DEKLARATION><DEKLARATION><ZULASSUNGSNUMMER>10167</ZULASSUNGSNUMMER><SEQUENZNUMMER>1</SEQUENZNUMMER><KOMPONENTENNUMMER>1</KOMPONENTENNUMMER><KOMPONENTE>(N/A)</KOMPONENTE><ZEILENNUMMER>16</ZEILENNUMMER><SORTIERUNG_ZEILENNUMMER>15</SORTIERUNG_ZEILENNUMMER><ZEILENTYP>S</ZEILENTYP><STOFF_ID>001F295B11971ED2B6E5CE4581755F9F</STOFF_ID><STOFFKATEGORIE>WIRKS</STOFFKATEGORIE><MENGE>0.202</MENGE><MENGEN_EINHEIT>MGG</MENGEN_EINHEIT><DEKLARATIONSART>1</DEKLARATIONSART></DEKLARATION><DEKLARATION><ZULASSUNGSNUMMER>10167</ZULASSUNGSNUMMER><SEQUENZNUMMER>1</SEQUENZNUMMER><KOMPONENTENNUMMER>1</KOMPONENTENNUMMER><KOMPONENTE>(N/A)</KOMPONENTE><ZEILENNUMMER>17</ZEILENNUMMER><SORTIERUNG_ZEILENNUMMER>16</SORTIERUNG_ZEILENNUMMER><ZEILENTYP>S</ZEILENTYP><STOFF_ID>001F295B11971ED2B6E5CEE7049A1F9F</STOFF_ID><STOFFKATEGORIE>WIRKS</STOFFKATEGORIE><MENGE>0.00432</MENGE><MENGEN_EINHEIT>MGG</MENGEN_EINHEIT><DEKLARATIONSART>1</DEKLARATIONSART></DEKLARATION><DEKLARATION><ZULASSUNGSNUMMER>10167</ZULASSUNGSNUMMER><SEQUENZNUMMER>1</SEQUENZNUMMER><KOMPONENTENNUMMER>1</KOMPONENTENNUMMER><KOMPONENTE>(N/A)</KOMPONENTE><ZEILENNUMMER>18</ZEILENNUMMER><SORTIERUNG_ZEILENNUMMER>17</SORTIERUNG_ZEILENNUMMER><ZEILENTYP>S</ZEILENTYP><STOFF_ID>001F295B11971ED2B6E5E7C978FE5FA6</STOFF_ID><STOFFKATEGORIE>WIRKS</STOFFKATEGORIE><MENGE>0.355</MENGE><MENGEN_EINHEIT>MGG</MENGEN_EINHEIT><DEKLARATIONSART>1</DEKLARATIONSART></DEKLARATION><DEKLARATION><ZULASSUNGSNUMMER>10167</ZULASSUNGSNUMMER><SEQUENZNUMMER>1</SEQUENZNUMMER><KOMPONENTENNUMMER>1</KOMPONENTENNUMMER><KOMPONENTE>(N/A)</KOMPONENTE><ZEILENNUMMER>2</ZEILENNUMMER><SORTIERUNG_ZEILENNUMMER>1</SORTIERUNG_ZEILENNUMMER><ZEILENTYP>S</ZEILENTYP><STOFF_ID>001F295B11971ED2B6E5D80C563C7FA0</STOFF_ID><STOFFKATEGORIE>WIRKS</STOFFKATEGORIE><MENGE>100</MENGE><MENGEN_EINHEIT>PMM</MENGEN_EINHEIT><DEKLARATIONSART>1</DEKLARATIONSART></DEKLARATION><DEKLARATION><ZULASSUNGSNUMMER>10167</ZULASSUNGSNUMMER><SEQUENZNUMMER>1</SEQUENZNUMMER><KOMPONENTENNUMMER>1</KOMPONENTENNUMMER><KOMPONENTE>(N/A)</KOMPONENTE><ZEILENNUMMER>4</ZEILENNUMMER><SORTIERUNG_ZEILENNUMMER>3</SORTIERUNG_ZEILENNUMMER><ZEILENTYP>S</ZEILENTYP><STOFF_ID>001F295B11971ED2B6E5D3684C07DF9F</STOFF_ID><STOFFKATEGORIE>WIRKS</STOFFKATEGORIE><MENGE>308.7</MENGE><MENGEN_EINHEIT>MGG</MENGEN_EINHEIT><DEKLARATIONSART>1</DEKLARATIONSART></DEKLARATION><DEKLARATION><ZULASSUNGSNUMMER>10167</ZULASSUNGSNUMMER><SEQUENZNUMMER>1</SEQUENZNUMMER><KOMPONENTENNUMMER>1</KOMPONENTENNUMMER><KOMPONENTE>(N/A)</KOMPONENTE><ZEILENNUMMER>5</ZEILENNUMMER><SORTIERUNG_ZEILENNUMMER>4</SORTIERUNG_ZEILENNUMMER><ZEILENTYP>S</ZEILENTYP><STOFF_ID>001F295B11971ED2B6E5D3692F19DF9F</STOFF_ID><STOFFKATEGORIE>WIRKS</STOFFKATEGORIE><MENGE>6.11</MENGE><MENGEN_EINHEIT>MGG</MENGEN_EINHEIT><DEKLARATIONSART>1</DEKLARATIONSART></DEKLARATION><DEKLARATION><ZULASSUNGSNUMMER>10167</ZULASSUNGSNUMMER><SEQUENZNUMMER>1</SEQUENZNUMMER><KOMPONENTENNUMMER>1</KOMPONENTENNUMMER><KOMPONENTE>(N/A)</KOMPONENTE><ZEILENNUMMER>6</ZEILENNUMMER><SORTIERUNG_ZEILENNUMMER>5</SORTIERUNG_ZEILENNUMMER><ZEILENTYP>S</ZEILENTYP><STOFF_ID>001F295B11971ED2B6E5CEA97341BF9F</STOFF_ID><STOFFKATEGORIE>WIRKS</STOFFKATEGORIE><MENGE>188.4</MENGE><MENGEN_EINHEIT>MGG</MENGEN_EINHEIT><DEKLARATIONSART>1</DEKLARATIONSART></DEKLARATION><DEKLARATION><ZULASSUNGSNUMMER>10167</ZULASSUNGSNUMMER><SEQUENZNUMMER>1</SEQUENZNUMMER><KOMPONENTENNUMMER>1</KOMPONENTENNUMMER><KOMPONENTE>(N/A)</KOMPONENTE><ZEILENNUMMER>7</ZEILENNUMMER><SORTIERUNG_ZEILENNUMMER>6</SORTIERUNG_ZEILENNUMMER><ZEILENTYP>S</ZEILENTYP><STOFF_ID>001F295B11971ED2B6E5CE8BA6429F9F</STOFF_ID><STOFFKATEGORIE>WIRKS</STOFFKATEGORIE><MENGE>474.4</MENGE><MENGEN_EINHEIT>MGG</MENGEN_EINHEIT><DEKLARATIONSART>1</DEKLARATIONSART></DEKLARATION><DEKLARATION><ZULASSUNGSNU